{
  "$schema": "https://json-schema.org/draft/2020-12/schema",
  "$id": "https://lufa-ai.dev/schemas/artifact.schema.json",
  "title": "Lufa AI artifact source",
  "type": "object",
  "additionalProperties": false,
  "required": [
    "id",
    "name",
    "description",
    "type",
    "authors",
    "provenance",
    "discovery",
    "versions"
  ],
  "properties": {
    "id": {
      "$ref": "#/$defs/identifier"
    },
    "name": {
      "type": "string",
      "minLength": 1
    },
    "description": {
      "type": "string",
      "minLength": 1
    },
    "type": {
      "type": "string",
      "pattern": "^[a-z][a-z0-9-]*$",
      "description": "Artifact kind; independent from its target environments."
    },
    "authors": {
      "type": "array",
      "minItems": 1,
      "uniqueItems": true,
      "items": {
        "type": "string",
        "minLength": 1
      }
    },
    "provenance": {
      "type": "object",
      "additionalProperties": false,
      "required": ["repository", "license"],
      "properties": {
        "repository": {
          "type": "string",
          "pattern": "^https://[^\\s]+$"
        },
        "license": {
          "type": "string",
          "minLength": 1
        }
      }
    },
    "discovery": {
      "type": "object",
      "additionalProperties": false,
      "required": ["categories", "keywords"],
      "properties": {
        "categories": {
          "$ref": "#/$defs/stringList"
        },
        "keywords": {
          "$ref": "#/$defs/stringList"
        }
      }
    },
    "versions": {
      "type": "array",
      "minItems": 1,
      "items": {
        "$ref": "#/$defs/version"
      }
    }
  },
  "$defs": {
    "identifier": {
      "type": "string",
      "pattern": "^[a-z0-9]+(?:-[a-z0-9]+)*$"
    },
    "stringList": {
      "type": "array",
      "uniqueItems": true,
      "items": {
        "type": "string",
        "minLength": 1
      }
    },
    "version": {
      "type": "object",
      "additionalProperties": false,
      "required": [
        "version",
        "publishedAt",
        "files",
        "compatibilities",
        "prerequisites",
        "warnings"
      ],
      "properties": {
        "version": {
          "type": "string",
          "minLength": 1,
          "description": "Validated as SemVer by the catalog validator."
        },
        "publishedAt": {
          "type": "string",
          "pattern": "^\\d{4}-\\d{2}-\\d{2}T\\d{2}:\\d{2}:\\d{2}(?:\\.\\d+)?Z$"
        },
        "files": {
          "type": "array",
          "minItems": 1,
          "items": {
            "$ref": "#/$defs/file"
          }
        },
        "compatibilities": {
          "type": "array",
          "minItems": 1,
          "items": {
            "$ref": "#/$defs/compatibility"
          }
        },
        "prerequisites": {
          "$ref": "#/$defs/stringList"
        },
        "warnings": {
          "$ref": "#/$defs/stringList"
        }
      }
    },
    "file": {
      "type": "object",
      "additionalProperties": false,
      "required": ["path", "destination"],
      "properties": {
        "path": {
          "type": "string",
          "minLength": 1,
          "description": "Path relative to this artifact's source directory."
        },
        "destination": {
          "type": "string",
          "minLength": 1,
          "description": "Path relative to the consumer project root."
        }
      }
    },
    "compatibility": {
      "type": "object",
      "additionalProperties": false,
      "required": ["environment", "level"],
      "properties": {
        "environment": {
          "type": "string",
          "pattern": "^[a-z][a-z0-9-]*$"
        },
        "level": {
          "enum": ["declared", "verified"]
        },
        "evidence": {
          "type": "object",
          "additionalProperties": false,
          "required": ["testedVersion", "method", "reference"],
          "properties": {
            "testedVersion": {
              "type": "string",
              "minLength": 1,
              "pattern": "\\S"
            },
            "method": {
              "type": "string",
              "minLength": 1,
              "pattern": "\\S"
            },
            "reference": {
              "type": "string",
              "minLength": 1,
              "pattern": "\\S"
            }
          }
        }
      },
      "allOf": [
        {
          "if": {
            "properties": {
              "level": {
                "const": "verified"
              }
            },
            "required": ["level"]
          },
          "then": {
            "required": ["evidence"]
          }
        }
      ]
    }
  }
}
