{
  "id": "hello-agent",
  "name": "Hello Agent",
  "description": "Un skill pilote minimal qui aide à produire une réponse d’accueil claire et structurée.",
  "type": "skill",
  "authors": ["Lufa AI maintainers"],
  "provenance": {
    "repository": "https://github.com/Grasdouble/Lufa-AI",
    "license": "MIT"
  },
  "discovery": {
    "categories": ["writing"],
    "keywords": ["greeting", "communication", "example"]
  },
  "versions": [
    {
      "version": "1.0.0",
      "publishedAt": "2026-10-10T00:00:00Z",
      "files": [
        {
          "path": "versions/1.0.0/SKILL.md",
          "destination": ".agents/skills/hello-agent/SKILL.md"
        }
      ],
      "compatibilities": [
        {
          "environment": "github-copilot",
          "level": "declared"
        },
        {
          "environment": "opencode",
          "level": "declared"
        }
      ],
      "prerequisites": [],
      "warnings": [
        "Compatibilité déclarée, non vérifiée pour ce skill pilote ; aucun résultat de test spécifique à cette version n'est disponible."
      ]
    }
  ]
}
